{
  "$schema": "https://json-schema.org/draft/2020-12/schema",
  "$id": "https://jiyaojun.local/schemas/artifact_envelope.json",
  "title": "ArtifactEnvelope",
  "type": "object",
  "additionalProperties": false,
  "required": [
    "artifact_id",
    "meeting_id",
    "org_domains",
    "scenario_type",
    "skill_pack_id",
    "artifact_kind",
    "schema_id",
    "schema_version",
    "payload",
    "confidence",
    "unresolved",
    "source_spans",
    "references",
    "classification",
    "continuum_write_class",
    "created_by_stage"
  ],
  "properties": {
    "artifact_id": { "type": "string", "minLength": 1 },
    "meeting_id": { "type": "string", "minLength": 1 },
    "org_domains": {
      "type": "array",
      "minItems": 1,
      "items": { "enum": ["eng", "business", "hr", "risk", "compliance"] }
    },
    "scenario_type": { "type": "string", "minLength": 1 },
    "skill_pack_id": { "type": "string", "minLength": 1 },
    "artifact_kind": {
      "type": "string",
      "enum": ["decision", "action_items", "risks", "verdict", "metrics", "draft", "summary_view", "other"]
    },
    "schema_id": { "type": "string" },
    "schema_version": { "type": "string", "pattern": "^[0-9]+\\.[0-9]+\\.[0-9]+$" },
    "payload": { "type": "object" },
    "confidence": {
      "oneOf": [
        { "type": "number", "minimum": 0, "maximum": 1 },
        { "enum": ["low", "med", "high"] }
      ]
    },
    "unresolved": {
      "type": "array",
      "items": {
        "type": "object",
        "required": ["code", "message"],
        "properties": {
          "code": { "type": "string" },
          "message": { "type": "string" },
          "blocking_embed": { "type": "boolean" }
        }
      }
    },
    "source_spans": {
      "type": "array",
      "items": {
        "type": "object",
        "properties": {
          "start_ms": { "type": "integer", "minimum": 0 },
          "end_ms": { "type": "integer", "minimum": 0 },
          "quote": { "type": "string" },
          "doc_id": { "type": "string" }
        }
      }
    },
    "references": {
      "type": "array",
      "items": {
        "type": "object",
        "required": ["corpus", "id"],
        "properties": {
          "corpus": { "enum": ["docs", "continuum", "transcript"] },
          "id": { "type": "string" },
          "span": { "type": "string" }
        }
      }
    },
    "chart_series": {
      "type": "array",
      "items": {
        "type": "object",
        "required": ["series_id", "label", "points"],
        "properties": {
          "series_id": { "type": "string" },
          "label": { "type": "string" },
          "unit": { "type": "string" },
          "points": {
            "type": "array",
            "items": {
              "type": "object",
              "required": ["x", "y"],
              "properties": {
                "x": { "type": ["string", "number"] },
                "y": { "type": "number" }
              }
            }
          }
        }
      }
    },
    "classification": {
      "enum": ["public", "internal", "confidential", "critical"]
    },
    "continuum_write_class": {
      "enum": ["wide", "domain", "sealed", "none"]
    },
    "created_by_stage": {
      "enum": ["understand", "artifact", "hitl_patch", "system"]
    }
  }
}
